{
  "$schema":"https://json-schema.org/draft/2020-12/schema","title":"Amazon UAE Research Evidence Bundle","type":"object","additionalProperties":false,
  "required":["research_run","keywords","products","evidence","source_summary"],
  "properties":{
    "research_run":{"type":"object","required":["id","marketplace","started_at","evidence_cutoff","filters","candidate_funnel"],"properties":{"id":{"type":"string","minLength":1},"slug":{"type":"string"},"marketplace":{"enum":["amazon.ae","A2VIGQ35RCS4UG"]},"started_at":{"type":"string","format":"date-time"},"evidence_cutoff":{"type":"string","format":"date-time"},"filters":{"type":"object"},"candidate_funnel":{"type":"object"}}},
    "keywords":{"type":"array","items":{"type":"string"}},
    "products":{"type":"array","items":{"$ref":"#/$defs/product"}},
    "evidence":{"type":"array","minItems":1,"items":{"$ref":"#/$defs/evidence"}},
    "source_summary":{"type":"object","additionalProperties":{"type":"string"}},
    "serpapi_usage":{"type":"object"},
    "serpapi_relevance":{"type":"array","items":{"type":"object"}},
    "risk_gap_research_plan":{"type":"object"},
    "provider_errors":{"type":"array","items":{"type":"object"}}
  },
  "$defs":{
    "product":{"type":"object","required":["niche","marketplace"],"properties":{"niche":{"type":"string"},"marketplace":{"enum":["amazon.ae","A2VIGQ35RCS4UG"]},"candidate_type":{"enum":["OBSERVED_MARKET_OPPORTUNITY","BUNDLE_HYPOTHESIS","DIFFERENTIATION_HYPOTHESIS"]},"asin":{"type":["string","null"]},"title":{"type":["string","null"]},"brand":{"type":["string","null"]},"current_price_aed":{"type":["number","null"],"minimum":0},"observed_market_price_aed":{"type":["number","null"],"minimum":0},"proposed_selling_price_aed":{"type":["number","null"],"minimum":0},"bundle_hypothesis_price_aed":{"type":["number","null"],"minimum":0},"fee_calculation_price_aed":{"type":["number","null"],"minimum":0},"original_price_aed":{"type":["number","null"],"minimum":0},"rating":{"type":["number","null"],"minimum":0,"maximum":5},"review_count":{"type":["integer","null"],"minimum":0},"availability":{"type":["string","null"]},"sponsored_status":{"type":["boolean","null"]},"search_position":{"type":["integer","null"],"minimum":0},"category":{"type":["string","null"]},"seller_fulfillment_hints":{"type":["string","null"]},"size":{"type":["string","null"]},"weight_kg":{"type":["number","null"],"minimum":0},"variation_count":{"type":["integer","null"],"minimum":0},"badge":{"type":["string","null"]}}},
    "evidence":{"type":"object","additionalProperties":false,"required":["id","metric_name","metric_value","metric_unit","asin","keyword","niche","marketplace","source_provider","source_type","source_url","source_title","observed_at","retrieved_at","confidence","is_estimate","notes"],"properties":{"id":{"type":"string","minLength":1},"metric_name":{"type":"string","minLength":1},"metric_value":{"type":["string","number","boolean","null"]},"metric_unit":{"type":["string","null"]},"asin":{"type":["string","null"]},"keyword":{"type":["string","null"]},"niche":{"type":["string","null"]},"marketplace":{"enum":["amazon.ae","A2VIGQ35RCS4UG"]},"marketplace_id":{"enum":["A2VIGQ35RCS4UG"]},"market_relevance":{"enum":["AMAZON_UAE","UAE_RETAIL","UAE_GENERAL","GCC","GLOBAL","OTHER_MARKETPLACE","UNKNOWN"]},"source_timezone":{"type":["string","null"]},"source_provider":{"type":"string"},"source_type":{"type":"string"},"source_url":{"type":["string","null"],"format":"uri"},"source_title":{"type":["string","null"]},"observed_at":{"type":"string","format":"date-time"},"retrieved_at":{"type":"string","format":"date-time"},"confidence":{"enum":["VERY_HIGH","HIGH","MEDIUM","LOW","VERY_LOW"]},"is_estimate":{"type":"boolean"},"notes":{"type":["string","null"]}}}
  }
}
