{
  "research_run":{"id":"fixture-run-1","slug":"drawer-organizer-fixture","marketplace":"amazon.ae","started_at":"2026-08-12T00:00:00Z","evidence_cutoff":"2026-08-12T00:10:00Z","filters":{"price_min":50,"price_max":150},"candidate_funnel":{"researched":30,"screened":12,"validated":1}},
  "keywords":["drawer organizer","منظم الأدراج"],
  "products":[
    {"niche":"adjustable drawer divider sets","marketplace":"amazon.ae","asin":"B0TESTAE01","title":"Adjustable Drawer Dividers 4 Pack","brand":"HomeNeat","current_price_aed":79.0,"rating":4.3,"review_count":124,"sponsored_status":false,"search_position":3,"weight_kg":null,"variation_count":2},
    {"niche":"adjustable drawer divider sets","marketplace":"amazon.ae","asin":"B0TESTAE02","title":"Expandable Drawer Organizer","brand":"SpaceWell","current_price_aed":99.0,"rating":4.1,"review_count":58,"sponsored_status":true,"search_position":7,"weight_kg":null,"variation_count":1}
  ],
  "evidence":[
    {"id":"ev-price-1","metric_name":"current_price_aed","metric_value":79,"metric_unit":"AED","asin":"B0TESTAE01","keyword":"drawer organizer","niche":"adjustable drawer divider sets","marketplace":"amazon.ae","source_provider":"codex_web","source_type":"web_search","source_url":"https://www.amazon.ae/dp/B0TESTAE01","source_title":"Indexed Amazon UAE product result","observed_at":"2026-08-12T00:05:00Z","retrieved_at":"2026-08-12T00:06:00Z","confidence":"MEDIUM","is_estimate":false,"notes":"Fixture; not live"},
    {"id":"ev-review-1","metric_name":"review_count","metric_value":124,"metric_unit":"reviews","asin":"B0TESTAE01","keyword":"drawer organizer","niche":"adjustable drawer divider sets","marketplace":"amazon.ae","source_provider":"codex_web","source_type":"web_search","source_url":"https://www.amazon.ae/dp/B0TESTAE01","source_title":"Indexed Amazon UAE product result","observed_at":"2026-08-12T00:05:00Z","retrieved_at":"2026-08-12T00:06:00Z","confidence":"LOW","is_estimate":false,"notes":"Fixture"},
    {"id":"ev-position-1","metric_name":"search_position","metric_value":3,"metric_unit":"position","asin":"B0TESTAE01","keyword":"drawer organizer","niche":"adjustable drawer divider sets","marketplace":"amazon.ae","source_provider":"serpapi","source_type":"structured_amazon_search","source_url":"https://serpapi.com/amazon-search-api","source_title":"SerpApi fixture","observed_at":"2026-08-12T00:05:00Z","retrieved_at":"2026-08-12T00:06:00Z","confidence":"HIGH","is_estimate":false,"notes":"Fixture; no API call"},
    {"id":"ev-competition-1","metric_name":"visible_competing_products","metric_value":18,"metric_unit":"products","asin":null,"keyword":"drawer organizer","niche":"adjustable drawer divider sets","marketplace":"amazon.ae","source_provider":"codex_web","source_type":"web_search","source_url":"https://www.amazon.ae/s?k=drawer+organizer","source_title":"Amazon UAE indexed search context","observed_at":"2026-08-12T00:05:00Z","retrieved_at":"2026-08-12T00:06:00Z","confidence":"LOW","is_estimate":true,"notes":"Visible sample, not total catalog"},
    {"id":"ev-risk-1","metric_name":"regulatory_risk","metric_value":"LOW","metric_unit":null,"asin":null,"keyword":null,"niche":"adjustable drawer divider sets","marketplace":"amazon.ae","source_provider":"amazon_public","source_type":"official_public_web","source_url":"https://sell.amazon.ae/","source_title":"Amazon UAE seller guidance fixture","observed_at":"2026-08-12T00:05:00Z","retrieved_at":"2026-08-12T00:06:00Z","confidence":"HIGH","is_estimate":true,"notes":"Category still requires seller validation"},
    {"id":"ev-fee-1","metric_name":"estimated_referral_fee_aed","metric_value":11.85,"metric_unit":"AED","asin":"B0TESTAE01","keyword":null,"niche":"adjustable drawer divider sets","marketplace":"amazon.ae","source_provider":"amazon_public","source_type":"official_public_web","source_url":"https://sell.amazon.ae/pricing","source_title":"Amazon UAE pricing fixture","observed_at":"2026-08-12T00:05:00Z","retrieved_at":"2026-08-12T00:06:00Z","confidence":"HIGH","is_estimate":true,"notes":"FBA fulfillment fee excluded"}
  ],
  "source_summary":{"Codex live web search":"USED","Amazon UAE official pages":"USED","SerpApi":"fixture only","DataForSEO":"unavailable","Rainforest":"unavailable","Amazon SP-API":"unavailable"}
}
